boss,loot_name,loot_url,type,bis,spec1,spec2,priority,notes
Magtheridon,Egide du redresseur de torts,https://www.wowhead.com/tbc/fr/item=29458,Bouclier,BP5,"Holy Paladin/
Resto Shaman","Paladin/Warrior/
Shaman",HPal > Rcham > PWar,"HPal BP5, RSha BP1"
Magtheridon,Cape du traqueur des puits,https://www.wowhead.com/tbc/fr/item=28777,Dos,,Physical DPS/ Tank,Physical DPS/ Tank,PRet > Rogue > Bear/PWar > Chasseur/Amélio/Fury/Arms,
Magtheridon,Bâton cœur-de-cristal à impulsions,https://www.wowhead.com/tbc/fr/item=28782,Arme 2M - Bâton,,Heal,Caster DPS,RDru/HPri > Rcham,
Magtheridon,Baguette d'oblitération érédar,https://www.wowhead.com/tbc/fr/item=28783,Baguette,BP1,Caster DPS,Heal,Mage > SP/Lock > HPri,Mage BP1
Magtheridon,Oeil de Magtheridon,https://www.wowhead.com/tbc/fr/item=28789,Bijou,BP5,"Caster DPS/
PPaladin",Caster DPS/ Heal,"Mage/Boomy/SP > 
Lock > Elem > PPal","Boom BP5, Mage BP5, Shadow BP5, Ele BP1, Lock BP3, PPal BP1"
Magtheridon,Ceinturon du puits sans fond,https://www.wowhead.com/tbc/fr/item=28779,Taille - Plaques,BP1,Melee,Tank,Fury/Arms > PRet,"Fury BP1, Arms BP1"
Magtheridon,Couteau de brèche de la fosse,https://www.wowhead.com/tbc/fr/item=28774,Arme 2M - Arme d'hast,BP1,Physical DPS,Tank,Arms > PRet > Chasseur > PWar,Arms BP1
Magtheridon,Talisman karaborien,https://www.wowhead.com/tbc/fr/item=28781,Main gauche,BP1,Caster DPS,Heal,Mage/Boomy > SP/Elem > Lock,"Boom BP1, Mage BP1"
Magtheridon,Gants langue-de-vipère,https://www.wowhead.com/tbc/fr/item=28776,Mains - Cuir,,Physical DPS/ Tank,Physical DPS/ Tank,Amélio/Fury/Arms > Cat/Chasseur > Rogue/Bear,
Magtheridon,Sacoche de seigneur des abîmes,https://www.wowhead.com/tbc/fr/item=34845,20 - Slot Bag,,ALL,,,Unique
Magtheridon,Protège-mains de dévoreur d'âmes,https://www.wowhead.com/tbc/fr/item=28780,Mains - Tissu,BP5,Caster DPS,Heal,SP > Boomy/Elem/Lock > Mage,Shadow BP5
Magtheridon,Ceinturon du puits de la terreur,https://www.wowhead.com/tbc/fr/item=28778,Taille - Mailles,,Hunt/RShaman,"Hunter/Shaman/
Paladin",Chasseur > Rcham > PRet/Amélio,
Magtheridon,Grand heaume de tonnerre,https://www.wowhead.com/tbc/fr/item=28775,Tête - Plaques,,Melee,Tank,PRet > Fury/Arms,
Magtheridon,Corselet du champion déchu,https://www.wowhead.com/tbc/fr/item=29754,Jeton d'armure,BP1,"PPal/HPal/Rog
RSha/Enh","Paladin/Rogue/
Shaman",PPal > HPal/Rcham > Rogue/Amélio,"PPal BP1, HPal BP1, Rog BP1, 
Enh BP1, RSha BP1
T4- Paladin/Rogue/Shaman"
Magtheridon,Corselet du défenseur déchu,https://www.wowhead.com/tbc/fr/item=29753,Jeton d'armure,BP1,"PWar/Druid
Priest","Warrior/Priest/
Druid",Bear/PWar > RDru/HPri > Boomy/SP > Cat,"Boom BP1, Bear BP1, RDru BP1,
Shadow BP1, PWar BP1
T4- Warrior, Priest, Druid"
Magtheridon,Corselet du héros déchu,https://www.wowhead.com/tbc/fr/item=29755,Jeton d'armure,BP1,"Mage/Lock/
Hunter",,Lock > Mage > Chasseur,"Lock BP1
T4- Hunter/Mage/Warlock"
Magtheridon,Tête de Magtheridon,https://www.wowhead.com/tbc/fr/item=32386,Quête,,ALL,,Tank > Heal > DPS,
Magtheridon,Chevalière de défense d'A'dal,https://www.wowhead.com/tbc/fr/item=28792,Quête,BP5,Tank,Melee,Bear > PWar > PPal,"Bear BP5, PWar BP1"
Magtheridon,Bague de la fureur cramoisie,https://www.wowhead.com/tbc/fr/item=28793,Quête,BP1,Caster DPS,Heal,"Mage/Boomy/Lock > Elem >
SP","Boom BP1, Mage BP1, Lock BP1"
Magtheridon,Bague de gardelumière naaru,https://www.wowhead.com/tbc/fr/item=28790,Quête,BP5,Heal,Caster DPS,HPri > Rcham > HPal > RDru,"HPri BP5, RSha BP4, HPal BP3"
Magtheridon,Anneau du récalcitrant,https://www.wowhead.com/tbc/fr/item=28791,Quête,BP1,Physical DPS,Tank,"Cat/PRet > Amélio > 
Chasseur/Rogue > Fury/Arms","Cat BP1, Ret BP1"
"Haut Roi Maulgar and the Ogre Council (Kiggler, Blindeye, Olm, Krosh)",Ceinture d'inspiration divine,https://www.wowhead.com/tbc/fr/item=28799,Taille - Tissu,BP1,Caster DPS/ HPriest,Caster DPS/ Heal,Mage/Lock/Boomy > SP/Elem/HPri > RDru/Rcham/HPal,"Boom BP1, Mage BP1, Lock BP1"
"Haut Roi Maulgar and the Ogre Council (Kiggler, Blindeye, Olm, Krosh)",Poignets de guerre flèchelame,https://www.wowhead.com/tbc/fr/item=28795,Poignets - Plaques,BP3,Warrior,Paladin,Fury/Arms > PWar > PRet,"Fury BP3, Arms BP3"
"Haut Roi Maulgar and the Ogre Council (Kiggler, Blindeye, Olm, Krosh)",Cape brutale de l'ogre-magi,https://www.wowhead.com/tbc/fr/item=28797,Dos,BP1,Caster DPS,Heal,Arcane Mage > Elem > Lock/Boomy > Mage,Arcane Mage BP1
"Haut Roi Maulgar and the Ogre Council (Kiggler, Blindeye, Olm, Krosh)",Marteau des Naaru,https://www.wowhead.com/tbc/fr/item=28800,Arme 2M - Masse,,Melee,Tank,PRet > Arms,
"Haut Roi Maulgar and the Ogre Council (Kiggler, Blindeye, Olm, Krosh)",Masque maléfique des ombres,https://www.wowhead.com/tbc/fr/item=28796,Tête - Cuir,BP1,Physical DPS/ Bear,Physical DPS/ Tank,Amélio > Rogue/PRet > Bear > Chasseur,Enh BP1
"Haut Roi Maulgar and the Ogre Council (Kiggler, Blindeye, Olm, Krosh)",Heaume de guerre de Maulgar,https://www.wowhead.com/tbc/fr/item=28801,Tête - Mailles,,Hunt/Enh,Physical DPS,Chasseur > Amélio,
"Haut Roi Maulgar and the Ogre Council (Kiggler, Blindeye, Olm, Krosh)",Espauliers du champion déchu,https://www.wowhead.com/tbc/fr/item=29763,Jeton d'armure,BP2,"Paladin/Rogue/
Shaman",,PPal > HPal > Rcham > Rogue/Elem > PRet > Amélio,"PPal BP1, HPal BP2, Ret BP1, 
Rog BP1, Ele BP1, RSha BP1
T4- Paladin/Rogue/Shaman"
"Haut Roi Maulgar and the Ogre Council (Kiggler, Blindeye, Olm, Krosh)",Espauliers du défenseur déchu,https://www.wowhead.com/tbc/fr/item=29764,Jeton d'armure,BP2,"PWar/Priest
Druid","Warrior/Priest/
Druid","PWar > RDru/HPri > 
Boomy > Cat/SP > Bear","Boom BP2, Cat BP1, RDru BP2, 
HPri BP2, Shadow BP1, 
PWar BP1, T4- Warrior/Priest/Druid"
"Haut Roi Maulgar and the Ogre Council (Kiggler, Blindeye, Olm, Krosh)",Espauliers du héros déchu,https://www.wowhead.com/tbc/fr/item=29762,Jeton d'armure,BP1,"Mage/Warlock/
Hunter",,Mage/Lock > Chasseur,"Mage BP1, Lock BP1
T4- Hunter/Mage/Warlock"
Gruul le Tue-dragon,Défendeur de l'hériBISe aldori,https://www.wowhead.com/tbc/fr/item=28825,Bouclier,BP1,Tank,Melee,PPal/PWar > PRet > Amélio,"PPal BP2, PWar BP1"
Gruul le Tue-dragon,Hache des seigneurs gronns,https://www.wowhead.com/tbc/fr/item=28794,Arme 2M - Hache,,Physical DPS,Tank,Arms > PRet > Chasseur > Amélio,
Gruul le Tue-dragon,Lame-magus Saignegueule,https://www.wowhead.com/tbc/fr/item=28802,Arme 1M - Épée,BP2,"PPal/Lock
Mage/Ret",Caster DPS/ Heal,PPal > Lock > Mage > PRet,"PPal BP2, Lock BP1"
Gruul le Tue-dragon,Collerette de Cho'gall,https://www.wowhead.com/tbc/fr/item=28804,Tête - Tissu,,Caster DPS,Heal,SP > Mage/Boomy,
Gruul le Tue-dragon,Capuche du souffle de la nature,https://www.wowhead.com/tbc/fr/item=28803,Tête - Cuir,,Heal,Caster DPS,RDru > HPal > Rcham,
Gruul le Tue-dragon,Trophée Epine-de-dragon,https://www.wowhead.com/tbc/fr/item=28830,Bijou,BP5,Physical DPS/ Tank,Physical DPS/ Tank,"Chasseur/PRet/Rogue/
Amélio/Fury/Arms > 
Cat/Bear/PWar > PPal","Hunt BP5, Ret BP5, Rog BP5, 
Enh BP5, Fury/Arms BP5, 
Feral BP1, PWar BP1 (DFT 2.0)"
Gruul le Tue-dragon,Oeil de Gruul,https://www.wowhead.com/tbc/fr/item=28823,Bijou,BP2,Heal,Caster DPS,RDru > HPal/HPri/Rcham,"RDru BP2, HPal BP1, HPRiest BP1, RSha BP1"
Gruul le Tue-dragon,Gantelets de la perfection martiale,https://www.wowhead.com/tbc/fr/item=28824,Mains - Plaques,BP3,Melee,Tank,Fury/Arms > PRet,"Fury BP3, Arms BP3"
Gruul le Tue-dragon,Gantelets du tueur de dragon,https://www.wowhead.com/tbc/fr/item=28827,Mains - Mailles,BP1,Hunt/Enh,Physical DPS/ Tank,Chasseur > Amélio > PRet,Hunt BP1
Gruul le Tue-dragon,Ceinturon cousu de Gronn,https://www.wowhead.com/tbc/fr/item=28828,Taille - Cuir,BP1,Physical DPS/ Bear,Physical DPS/ Tank,Rogue/Amélio > Feral > Fury/Arms > Chasseur > PRet,"Rog BP1, Enh BP1"
Gruul le Tue-dragon,Shuriken de négation,https://www.wowhead.com/tbc/fr/item=28826,Arme de jet,,Rogue/PWar,Physical DPS/ Tank,Rogue/PWar > Fury/Arms,
Gruul le Tue-dragon,Dent de Gruul,https://www.wowhead.com/tbc/fr/item=28822,Cou - Collier,BP2,"Boom/RDru
RSha/HPri
Mage/HPal",Caster DPS/ Heal,"RDru/Rcham/HPri > Boomy > 
HPal> Mage > Lock/SP","Boom BP2, RDru BP2, RSha BP2, HPri BP1"
Gruul le Tue-dragon,Bottes des Cisailles,https://www.wowhead.com/tbc/fr/item=28810,Pieds - Mailles,BP2,Ele Shaman,Shaman/Paladin,Elem chaman,Ele BP2
Gruul le Tue-dragon,Chevalière terrestre,https://www.wowhead.com/tbc/fr/item=31750,Quête,,ALL,,,
Gruul le Tue-dragon,Jambières du champion déchu,https://www.wowhead.com/tbc/fr/item=29766,Jeton d'armure,BP1,"Rogue/Paladin
Ele/RSha","Rogue/Paladin
Shaman",Rogue > PPal > PRet/Elem > HPal/Rcham,"Rog BP1
T4 - Paladin/Rogue/Shaman"
Gruul le Tue-dragon,Jambières du défenseur déchu,https://www.wowhead.com/tbc/fr/item=29767,Jeton d'armure,BP1,"Warrior/Bear
Shadow/RDru","Warrior/
Priest/Druid",PWar > RDru > Bear > SP/Fury/Arms,"PWar BP1, RDru BP1
T4- Warrior/Priest/Druid"
Gruul le Tue-dragon,Jambières du héros déchu,https://www.wowhead.com/tbc/fr/item=29765,Jeton d'armure,BP1,"Lock/Mage/
Hunter",,Lock > Mage > Chasseur,"Lock BP1
T4- Hunter/Mage/Warlock"
Seigneur Funeste Kazzak,Ancienne cape ensorcelée des Bien-nés,https://www.wowhead.com/tbc/fr/item=30735,Dos,BP1,Caster DPS,Heal,"SP > Boomy/Lock >
Elem > Mage",Shadow BP1
Seigneur Funeste Kazzak,Bâton de vie de l'Exodar,https://www.wowhead.com/tbc/fr/item=30732,Arme 2M - Bâton,BP1,Heal,Caster DPS,RDru > Rcham > HPri > HPal,RDru BP1
Seigneur Funeste Kazzak,Bottes sauvages feuille-d'or,https://www.wowhead.com/tbc/fr/item=30737,Pieds - Cuir,BP2,Heal,Caster DPS,HPal > Rcham > RDru,"HPal BP2, RSha BP1"
Seigneur Funeste Kazzak,Fin de l'espoir,https://www.wowhead.com/tbc/fr/item=30733,Arme 1M - Épée,BP1,Melee,Physical DPS/ Tank,Rogue/Fury > Chasseur > Arms,"Rog BP1, Fury BP1"
Seigneur Funeste Kazzak,Jambières du septième cercle,https://www.wowhead.com/tbc/fr/item=30734,Jambes - Tissu,BP3,Caster DPS,Heal,SP/Lock/Elem > Boomy > Mage,"Shadow BP3, Ele BP3, Lock BP3, Boom BP1"
Seigneur Funeste Kazzak,Anneau de la lumière fluide,https://www.wowhead.com/tbc/fr/item=30736,Doigt - Anneau,BP5,Heal,Caster DPS,HPal/Rcham > HPri/RDru,"HPal BP5, HPri BP2, RSha BP5, RDru BP1"
Seigneur Funeste Kazzak,Anneau de réciprocité,https://www.wowhead.com/tbc/fr/item=30738,Doigt - Anneau,BP3,Physical DPS,Tank,"PRet/Rogue/Fury/Arms
Chasseur/Cat/Amélio","Cat BP1, Hunt BP1, Ret BP3, 
Rog BP2, Enh BP1, 
Fury BP1, Arms BP1"
Seigneur Funeste Kazzak,Plaques d'épaule d'éventreur de démons,https://www.wowhead.com/tbc/fr/item=30740,Épaules - Plaques,BP5,Melee,Tank,Fury/Arms > PRet,"Fury BP5, Arms BP5, Ret BP3"
Seigneur Funeste Kazzak,Grèves du tireur d'élite en écailles,https://www.wowhead.com/tbc/fr/item=30739,Jambes - Mailles,BP1,Physical DPS,Tank,Chasseur/PRet/Amélio/Fury/Arms,"Hunt BP1, Ret BP1, Enh BP1, 
Fury BP1, Arms BP1"
Seigneur Funeste Kazzak,Poignes de bataille cloutées de topazes,https://www.wowhead.com/tbc/fr/item=30741,Mains - Plaques,,Tank,Melee,Prot Paladin/Prot Warrior,
Marche-Funeste,Gants de la colère étincelante,https://www.wowhead.com/tbc/fr/item=30725,Mains - Tissu,BP5,Caster DPS,Heal,"Lock > Elem > Mage > 
Boomy/SP","Lock BP5, Ele BP2, Mage BP1"
Marche-Funeste,Charme de présence archaïque,https://www.wowhead.com/tbc/fr/item=30726,Cou - Collier,BP2,Heal,Caster DPS,HPal > RDru > HPri/Rcham,HPal BP2
Marche-Funeste,Carabine longue lame-canon,https://www.wowhead.com/tbc/fr/item=30724,Fusil,BP4,"Hunter/Rogue/
Warrior",Physical DPS/ Tank,"Chasseur > Fury/Arms > 
Rogue > PWar","Fury BP4, Arms BP4, Rog BP2, 
PWar BP1, Hunt BP1"
Marche-Funeste,Cape de bataille fer-noir,https://www.wowhead.com/tbc/fr/item=30729,Dos,BP2,Physical DPS,Tank,PRet > Amélio > Rogue/Cat/Chasseur > Fury/Arms,"Ret BP2, Enh BP1"
Marche-Funeste,Déchireuse du nexus de l'Ethereum,https://www.wowhead.com/tbc/fr/item=30722,Arme 2M - Hache,BP2,Ret/Arms,Physical DPS/ Tank,PRet > Arms > Chasseur/Amélio,"Ret BP2, Arms BP2"
Marche-Funeste,Ventaille de la veille interminable,https://www.wowhead.com/tbc/fr/item=30731,Tête - Plaques,,Tank,Physical DPS,Prot Paladin/Prot Warrior,
Marche-Funeste,Heaume-sonde des profondeurs,https://www.wowhead.com/tbc/fr/item=30728,Tête - Mailles,BP1,RSha/HPal,Shaman/Paladin,Rcham > HPal,RSha BP1
Marche-Funeste,Chausses dorées de bénédiction,https://www.wowhead.com/tbc/fr/item=30727,Jambes - Tissu,BP2,Heal,Caster DPS,HPal/HPri > RDru > Rcham,"HPal BP2, HPri BP2, RDru BP1"
Marche-Funeste,Serre de la tempête,https://www.wowhead.com/tbc/fr/item=30723,Arme 1M - Dague,BP2,Caster DPS,Heal,Lock/Mage > Boomy/SP/Elem,"Mage BP2, Lock BP2, Boom BP1, 
Shadow BP1, Ele BP1"
Marche-Funeste,Tunique en tisse-terreur,https://www.wowhead.com/tbc/fr/item=30730,Torse - Cuir,BP1,Physical DPS,Tank,Cat/Chasseur/Amélio/Fury/Arms > Rogue,"Cat BP1, Hunt BP1, Enh BP1, 
Fury BP1, Arms BP1"
